{"schemaVersion":"1.0.0","pilotId":"pilot-mechanics-001","teams":[{"teamId":"team-alpha-001","profile":"repository_documents","setupElapsedMs":1200,"observationWeeks":2,"advisoryEnabledAtEnd":true,"consentRecorded":true},{"teamId":"team-beta-001","profile":"external_requirements","setupElapsedMs":null,"observationWeeks":3,"advisoryEnabledAtEnd":false,"consentRecorded":true},{"teamId":"team-gamma-001","profile":"runtime_staging","setupElapsedMs":2400,"observationWeeks":4,"advisoryEnabledAtEnd":null,"consentRecorded":true}],"runs":[{"runId":"run-001","teamId":"team-alpha-001","hostFamily":"codex","hostVersion":"26.707.3748.0","instructionVersion":"pilot-1.0.0","outcome":"completed_findings","durationMs":100,"contextCharacters":1000,"evidenceItemCount":2,"schemaCompatible":true,"findings":{"total":4,"validEvidenceReferences":3,"acceptedConfirmed":1,"dismissedFalsePositive":1,"inconclusive":1,"unreviewed":1}},{"runId":"run-002","teamId":"team-alpha-001","hostFamily":"claude_code","hostVersion":"2.1.217","instructionVersion":"pilot-1.0.0","outcome":"completed_no_findings","durationMs":200,"contextCharacters":2000,"evidenceItemCount":0,"schemaCompatible":true,"findings":{"total":0,"validEvidenceReferences":0,"acceptedConfirmed":0,"dismissedFalsePositive":0,"inconclusive":0,"unreviewed":0}},{"runId":"run-003","teamId":"team-beta-001","hostFamily":"opencode","hostVersion":"1.18.4","instructionVersion":"pilot-1.0.0","outcome":"failed_host","durationMs":30,"contextCharacters":0,"evidenceItemCount":0,"schemaCompatible":false,"findings":{"total":0,"validEvidenceReferences":0,"acceptedConfirmed":0,"dismissedFalsePositive":0,"inconclusive":0,"unreviewed":0}},{"runId":"run-004","teamId":"team-beta-001","hostFamily":"codex","hostVersion":"26.707.3748.0","instructionVersion":"pilot-1.0.0","outcome":"inconclusive","durationMs":80,"contextCharacters":500,"evidenceItemCount":1,"schemaCompatible":true,"findings":{"total":0,"validEvidenceReferences":0,"acceptedConfirmed":0,"dismissedFalsePositive":0,"inconclusive":0,"unreviewed":0}},{"runId":"run-005","teamId":"team-gamma-001","hostFamily":"opencode","hostVersion":"1.18.4","instructionVersion":"pilot-1.0.0","outcome":"completed_findings","durationMs":300,"contextCharacters":3000,"evidenceItemCount":4,"schemaCompatible":false,"findings":{"total":2,"validEvidenceReferences":1,"acceptedConfirmed":0,"dismissedFalsePositive":0,"inconclusive":0,"unreviewed":2}},{"runId":"run-006","teamId":"team-gamma-001","hostFamily":"claude_code","hostVersion":"2.1.217","instructionVersion":"pilot-1.0.0","outcome":"failed_validation","durationMs":40,"contextCharacters":100,"evidenceItemCount":0,"schemaCompatible":false,"findings":{"total":0,"validEvidenceReferences":0,"acceptedConfirmed":0,"dismissedFalsePositive":0,"inconclusive":0,"unreviewed":0}}]}
